{
  "protocol_version": "0.1.0",
  "message_type": "ProtocolEvent",
  "event_id": "evt_1234abcd",
  "event_kind": "state_changed",
  "source": "command",
  "command_id": "cmd_execute_action",
  "emitted_at": "2026-03-10T00:00:00Z",
  "status": {
    "workflow_state": "blocked",
    "runnable_nodes": 0,
    "blocked_nodes": 1,
    "pending_gates": 0,
    "active_jobs": 0,
    "health": "warning",
    "messages": ["Fresh review obligation is active."]
  },
  "graph_version": 3
}
